2017-11-13 21:56:58,颜色分类:金色,工欲善其事，必先利其器。从未用过挂烫机的小白为了简单省事，挑了好久双十一直接入手了一高端产品。熨烫效果直接看图，不可思议的是，只花了一分钟（我用的四档）。正好要穿呢子衣，也不晓得适不适合用，可是效果那是真好。直接挂着烫的，都没用板儿，半分钟明显的大褶子就没了，接着再精准熨了一会儿，前后不到一分钟，衣服就平整了！爱上熨衣的节奏！双十一入手价格还是很合适的，颜值也高，物流也快。飞利浦忠实顾客，一分钱一分货，想图省心又要效果的墙裂推荐！本来我爹听说我要买个熨烫机还说那你得有时间熨啊，然后一看我这效果～咩哈哈哈，秒杀老一辈的熨烫观～赞～
2018-06-18 17:55:13,颜色分类:金色,宝贝包装特别的结实  而且产品一看就是特别高大上  东西很沉  特别有质感  拿回来之后试着熨了一件衬衫  效果也不错  值得选购  😁😁
2017-11-18 14:43:11,颜色分类:金色,比3-4百的强多了，价钱也很好，坐等赠品了
2017-11-12 13:30:33,颜色分类:金色,相信大品牌，看到女儿家的很好用，双十一果断入手，满意，5分。
2017-11-16 19:14:40,颜色分类:金色,这挂烫机真不错，外观高大上。而且蒸汽特别给力。
2017-11-13 21:18:33,颜色分类:金色,安装简单 特别容易上手 熨烫效果杠杠滴 加上双11划算价格 值?
2017-11-24 18:35:08,颜色分类:金色,蒸汽大，比以前买的200、300元的好多了。
2017-11-19 12:55:17,颜色分类:金色,安装方便，使用简单。熨烫效果自然。
2017-11-14 19:59:42,颜色分类:金色,今天收到货就迫不及待试用了下，果真蒸汽很足，比我以前的300块的挂烫机好用太多。双11价格入手，还有一堆赠品领，yeah。
2017-10-17 22:32:05,颜色分类:金色,特别特别棒的挂烫机！一上去就烫平啦！
2018-03-29 10:27:47,颜色分类:金色,好用
2018-01-21 16:59:05,颜色分类:金色,不错
2018-03-23 21:57:16,颜色分类:金色,安装好了，试了一下，挺好用的。放在家里也很美观，喜欢。
2017-11-14 23:27:56,颜色分类:金色,宝贝收到了。装好试用一下。跟描述的一样蒸汽大，定型好。非常满意。
2018-01-07 08:01:04,颜色分类:金色,体积好大，很站空间
2018-05-04 12:11:26,颜色分类:金色,好
2017-11-21 16:16:40,颜色分类:金色,此用户没有填写评论!
2018-03-26 11:56:42,颜色分类:金色,好用！
2018-07-04 19:50:06,颜色分类:金色,做工一般吧，但是蛮好使的，比之前松下的好，毕竟价钱在那摆着呢
2018-06-19 14:58:27,颜色分类:金色,非常好用，烫一件衣服轻轻松松几分钟就搞定。也推荐给身边的好朋友入手了。特地感谢cs12客服，超级有耐心，每次都是秒回我。谢谢你！ps：这手套🧤好用 哈哈哈哈哈😂
2017-12-11 16:38:56,颜色分类:金色,此用户没有填写评论!
2018-04-15 11:34:20,颜色分类:金色,此用户没有填写评论!
2018-03-14 10:57:02,颜色分类:金色,还没用，用过再来追评
2018-01-10 11:33:41,颜色分类:金色,很好
2017-12-17 00:23:13,颜色分类:金色,操作简单，很好用
2018-01-14 23:24:23,颜色分类:金色,设计合理，好用！
2017-12-15 18:15:42,颜色分类:金色,非常好用
2017-11-22 21:51:31,颜色分类:金色,外箱一点都不损坏，安装方便，还没开始使用。
2017-11-18 09:44:15,颜色分类:金色,还没用包装不错
2018-04-18 16:49:51,颜色分类:金色,买的第二个了，这一款功能更全功率更大了，用起来很顺手，客服cs5的服务热情周到，必须点赞！
2018-09-28 09:11:11,颜色分类:金色,收到货后，很满意。物流很快，包装的箱子都用了三层，货物完美。试用了一下，蒸汽量很大。只是那个倾斜30度的板不知怎么，总是弄不好。一次不错的购物体验。
2018-06-16 19:58:55,颜色分类:金色,还不错吧，用起来还可以，但愿我不要让它在那接灰。。
2017-11-23 21:29:58,颜色分类:金色,11/11拍的，11/13就收到了。双十一收到的第一个快递。一直工作忙还带两个孩子，没时间第一时间试用。今天终于倒出空来了。效果满意，符合我的要求。上图。我就随便走了2下，就平了
2018-06-13 13:44:18,颜色分类:金色,还没拆，买了准备新房子里用的，大品牌应该不错的
2017-12-12 23:31:36,颜色分类:金色,此用户没有填写评论!
2017-11-27 20:55:30,颜色分类:金色,质量不错，就该信任大牌
2017-12-03 08:37:28,颜色分类:金色,双十一活动很优惠，比平时都要划算，收到之后很大一个箱子，自己拼装简单，就是活动送的礼品真的很慢，要等好久好久
2017-11-17 10:38:08,颜色分类:金色,包装很结实，用了两层纸箱，安装简单，确实一分价钱一分货，比几百块的好用多了，小家电就选飞利浦！
2017-11-20 09:59:13,颜色分类:金色,颜值高，功率大，母上很喜欢～
2018-06-09 17:03:05,颜色分类:金色,等使用后再评价还没拆开，包了三层📦应该好吧
2017-11-24 09:42:30,颜色分类:金色,显示到派送点好久，今天终于终于拿到了。好大一个箱子，包裹得好严实。拆开后也被惊到了，没想到那么大一个?出乎意料。说明书有点鸡肋，照着上面装居然装错了，发现原来开始自己摸索的是对的(?&omega;?) 水箱有些小了，热气还是很大的。就是伴随着蒸汽量大，烫好衣服有点潮湿也是逃不掉的。但是效果还不错。现在有点手生，等用过两次再来分享经验。 现在就坐等150大礼包和杨洋版娇兰唇膏咯?
2017-12-01 11:38:17,颜色分类:金色,双十一价格太好了，很好用，推荐
2018-06-19 19:02:57,颜色分类:金色,宝贝己收到迫不及待的打开按说明已组装好，和描述的相同很大气很喜欢、大品牌就是好，以后在买家电还要飞利浦的电器质量就是好。
2018-04-09 10:19:00,颜色分类:金色,还可以
2018-05-19 10:42:23,颜色分类:金色,此用户没有填写评论!
2017-11-24 10:51:35,颜色分类:金色,购物过程比较曲折，好在最后还是收到了，还可以吧，试了一下。
2018-04-28 18:04:23,颜色分类:金色,此用户没有填写评论!
2017-11-28 21:17:13,颜色分类:金色,很好！
2018-04-29 21:55:11,颜色分类:金色,很好用👍
2018-06-20 22:04:49,颜色分类:金色,熨烫效果不错，就是加热时候走哒哒哒的声音，不加热时就没有声音。问了客服说声音正常。
2018-02-11 00:43:52,颜色分类:金色,很好
2018-02-11 16:17:42,颜色分类:金色,商品质量不像是飞利浦的品质，还居然有电机马达的声音，在蒸汽的强烈嗤嗤声的同时，也能清晰听见。 服务态度无法评判，售后估计太麻烦，算了。
2018-04-27 23:46:21,颜色分类:金色,很好用，普通的衬衫，呢大衣，西装都能烫
2018-10-02 20:15:44,颜色分类:金色,质量一般般，价钱太贵，有种被欺骗的感觉。
2018-10-18 11:15:18,颜色分类:金色,性价比不高的感觉
2018-04-10 11:52:31,颜色分类:金色,好
2018-06-20 14:55:11,颜色分类:金色,这款挂烫机外型美观时尚，组装起来很方便，因放在新房内还没使用，等用过后再追加评论。值得一提的是包装有三层，很好的保护了商品，还有就是商品搞活动期间价格变化有些波动，我试着和客服人员沟通了一下，结果让我很满意，这里特别感谢客服C16的周到服务，非常感谢！
2017-12-14 21:45:22,颜色分类:金色,很喜欢
2018-07-19 11:22:25,颜色分类:金色,发货迅速，蒸汽大，参加活动挺划算，赠品与货品同时到达
2018-03-27 10:29:29,颜色分类:金色,包裹在没签收的情况下给我签收了 拒签还不给退钱 这就是天猫飞利浦的厉害 店大欺客 呵呵哒 淘宝还不让评价也是厉害！买的二件同样商品，还没确认收货就降价还不给退差价，是给了国家和天猫多少好处，迟家要滚出中国
2017-12-15 17:39:23,颜色分类:金色,家人代收，还没有使用。据说箱子巨大
2017-11-18 16:45:13,颜色分类:金色,安装方便
2017-11-24 15:14:44,颜色分类:金色,新店开张 原本在另一家买了这一款 买之前说的各种好 结果从11号到21号都没发货 22在这家旗舰店下了单 第二天上午就到货 烫了三壶水 水器量大 不漏水 喷气均匀 各种面料都适合 很好的品质 对得起这个价格
2017-11-14 16:30:40,颜色分类:金色,双十一抢购今天就收到货了，包装严实安装很方便，试用了很赞的一款挂烫机非常好用，带智能的喷气口用起来安全。这下好了在长的裙子挂烫一下穿出去都美美哒
2018-06-23 09:58:44,颜色分类:金色,总体感觉很OK 唯一问题手柄居然不能控制机器发开关....只能按住暂停建议后期改进一下设计，蒸气出去不会有水滴流出，这个是比200-600的挂烫机要好的多的地方
2018-05-31 21:14:02,颜色分类:金色,想要这款一年了，蒸汽量大，第一次买挂烫机，使用感还不错，用量不多，熨烫效果还可以，就是技巧生疏要多练习
2018-11-28 18:10:58,颜色分类:金色,包装很严实，质量没得话说。
2017-10-23 21:19:56,颜色分类:金色,好
2018-02-20 18:57:36,颜色分类:金色,初四下午下单，第二天上午就到货了，机器也很好用，赞
2018-04-06 23:22:38,颜色分类:金色,东西不错
2018-03-12 13:44:40,颜色分类:金色,看着不错，还没用，过后再评论。
2018-06-07 20:45:48,颜色分类:金色,这个是我在商场看好的，立马把刚买半年的美的的送人了，这个好用极了！喜欢的不知该如何表达
2017-11-26 16:51:41,颜色分类:金色,早就盯上这款挂烫机了，之前最低也要1399，双十一果断入手！到手价1100多，还有赠品！超值！
2018-03-04 12:22:29,颜色分类:金色,产品还算不错吧，但是也没有想象中那么好，那个30度真的是很难搞，再就是安装的时候，最开始那个管子插的时候要摁住底盘上的按钮，说明书很粗糙，几乎没啥用，客服也不管，给个400电话自己问。感觉服务不是太好。赠品是一个飞利浦的剃毛器，还没发。
2017-12-02 18:29:31,颜色分类:金色,容易用，挺满意的。
2018-12-03 09:03:23,颜色分类:金色,此用户没有填写评论!
2018-05-16 19:14:22,颜色分类:金色,不错，因为可以自动断蒸汽才买的，很适合我这种没有记性容易忘记关电的人
2018-08-18 18:05:46,颜色分类:金色,此用户没有填写评论!
2018-06-23 10:53:57,颜色分类:金色,快递小哥挺好给送到家还帮忙给拆开包装盒，检查配件齐全，迫不及待的组装好，宝贝颜值高大气，不愧是大品牌。安装好特地拿件衣服试了一下，蒸汽很足一会儿就熨烫平整，衣服会有水滴印，不过没事一会儿就干了，衣服和新的一样，气管会有一定温度，但是不会烫伤，总之宝贝很好没让我失望。
2018-02-28 18:52:16,颜色分类:金色,好漂亮的挂烫机，也很智能！喜欢。
2017-11-14 16:07:47,颜色分类:金色,应该不会有问题吧包装有些!等看后再评论!
2018-03-16 12:32:46,颜色分类:金色,很好用，感觉衣服都变高级了，值得购买
2018-09-13 23:58:56,颜色分类:金色,高颜值，大蒸汽！衣服熨得平整，带板不需要弯腰熨烫很方便！
2018-05-23 04:59:13,颜色分类:金色,好好好好好好好好好好好好好好好好好好好好好好好好好好好好好好好好好好好好好好好好好好好好好好好好好好好好好好好好好好好好好好好好好好好好好好好好好好好好好好好好好好好好好好好好好好好好好好好好好好好好好
2018-04-12 13:23:38,颜色分类:金色,一分价钱一分货！ 对挂烫机的熨烫效果不是特别期待，但是一试惊讶了，对我这样懒主妇绝对是好帮手。赞！
2018-11-18 15:10:10,颜色分类:金色,挂烫机安装方便，熨烫效果不错，很满意。
2018-09-17 16:27:47,颜色分类:金色,的确是台很不错用的挂烫，只是之前刚收货就发现降价了，感觉买的有点不巧😂😂😂
2018-03-16 11:31:52,颜色分类:金色,Ok的
2017-11-12 21:56:29,颜色分类:金色,熨板稍微有点短小 其他都不错
2018-06-01 13:59:01,颜色分类:金色,毛呢大衣也能烫平，薄的衣服更是不在话下，出气的管子不会折扁，不会断气，满意！
2018-04-15 20:18:45,颜色分类:金色,此用户没有填写评论!
2018-05-22 21:10:54,颜色分类:金色,马上试用了 挺不错的～
2018-06-26 09:15:53,颜色分类:金色,确实很高大上，操作非常简便，熨烫效果非常好。就是客服不太给力
2017-11-18 17:24:16,颜色分类:金色,一直就关注这款挂烫机，在实体店看了下跟它一样的要2399元，现在省了不少钱，很开心。一开始担心会不会很好，收到以后迫不及待的使用了一下，非常不错。值得够买！赠品还没有收到，好期待！
2017-11-19 23:49:27,颜色分类:金色,满意
2018-02-15 14:34:49,颜色分类:金色,这款很好用，喷气不中断
2017-11-19 14:16:46,颜色分类:金色,挂烫机收到了，质量特别好，外观上档次，设计相当科学，使用了下很不错，衣服烫的特别平整，只是收到货挂烫机外观稍微有点划痕，反馈给店家，店家处理的很满意，服务特别好，好评
2017-11-18 15:23:50,颜色分类:金色,客服是摆看的吗？？东西有问题问了几天客服都没人理！！算我认栽！第一次给差评，恭喜！！！
2018-07-22 17:06:35,颜色分类:金色,非常好，以前用的挂烫机出现的问题这个都没有，就是必须戴手套，差点烫伤，蒸汽很足，一分价钱一分货
2017-11-28 21:37:49,颜色分类:金色,挺好用的。
2018-03-23 14:38:22,颜色分类:金色,目前试用很好！?
2017-12-20 17:11:41,颜色分类:金色,一分钱一分货，应该说挺好用的，但上挂衣板上挂衣服，挺费事的
2017-11-22 12:54:18,颜色分类:金色,不错，特意拿了件大衣试了下，效果非常好
2017-11-12 15:18:23,颜色分类:金色,还没用，给好评吧
2018-06-12 21:33:42,颜色分类:金色,给家人买的，试用后感觉蒸汽出气量挺大，用起来很舒服，烫衣服超级快。有好几档可以切换。 物流很棒，三层纸箱包装严实，寄到云南小城市也没有损坏
2018-10-18 20:25:28,颜色分类:金色,超级好
2018-08-03 21:26:09,颜色分类:金色,飞利浦品牌的家电就是好，值得信赖，家里有一台电熨斗，也是飞利浦的，很好用，有了挂烫机就更方便了，而且来的时候包装很结实，里里外外三层，很安全，值得推荐，很好。?
2017-11-27 13:00:01,颜色分类:金色,双十一拍下的挂烫机，到现在还没收到货，系统都显示交易完成了还没到。售后服务烂，问了也没反应。
2017-11-14 22:23:06,颜色分类:金色,试用了一下，还不错，比原来的好用多了。
2018-12-04 14:07:03,颜色分类:金色,好评
2018-04-13 13:10:55,颜色分类:金色,外包装完好无损，还没有组装起来用，应该不错，箱子里面配件齐全，大品牌的东西有保证，买的放心。
2017-11-17 13:50:46,颜色分类:金色,不错
2018-04-18 17:11:09,颜色分类:金色,此用户没有填写评论!
2018-01-01 12:11:08,颜色分类:金色,东西还是不错的，不过还是双十一划算，下次做好计划双十一买，起码节约400
2017-11-16 15:00:58,颜色分类:金色,挺不错的 真的是一分价一分货 赠品还没到 到了再追加 好评好评好评！
2018-01-23 16:08:30,颜色分类:金色,好用
2019-01-17 20:06:42,颜色分类:金色,还送了烤面包机、家里已经有两个了，要是不送东西减点钱就好了
2017-12-14 14:11:48,颜色分类:金色,此用户没有填写评论!
2017-12-07 21:39:05,颜色分类:金色,此用户没有填写评论!
2018-11-19 18:55:30,颜色分类:金色,双十一下单，今天才收到，时间上有点晚。回来试着安装好了，没来及看说明书，还不会使用，感觉还可以吧。
2018-04-22 14:13:30,颜色分类:金色,好用
2018-11-19 23:55:40,颜色分类:金色,东西收到，试了下挺好的，底盘结实，双杆就是棒。出气量大，超喜欢。
2018-11-26 17:27:34,颜色分类:金色,方便，好用，蒸汽调节功能不错，易操作，外观也非常好看！👍👍👍
2017-11-16 18:32:43,颜色分类:金色,包装的确够专业，但说明书有点乱，没有明确的安装说明，完全凭借经验才完成安装。可笑的是手持杆和蒸汽斗在出厂前预安装时给我装反了，导致那个30度倾斜居然是向前倾斜，好不容易找到了原因才让我给纠正过来了。蒸汽出汽比较均匀，但似乎热量不够，衣服烫完湿湿的，以前两百多的挂烫机都没有这个现象。优点是低位熨烫时蒸汽也不会变小，这是目前为止我觉得唯一优于老式挂烫机的地方。特别不好的是，预售价格居然比双十一当天购买的价格贵，虽然只贵十几块，但我觉得这违反了预售原则，对吗？
2018-11-19 16:01:48,颜色分类:金色,虽然发货时间慢了一点，毕竟是双十一，可以理解。收到东西后就立马打开体验一把：包装很好，双层保护。挂烫机设计很漂亮，而且使用很方便，烫衣头上有按钮，可以五档调节，很方便；水箱足够大，加一次水可以烫秋冬的大衣外套十来件差不多；组装非常简单，不用看说明书就可以轻松组装，赞👍👍👍；烫衣架底部有滑轮，移动很方便；总之而言：物有所值。
2018-08-16 21:04:00,颜色分类:金色,此用户没有填写评论!
2017-11-22 21:25:57,颜色分类:金色,双十一拍下的挂烫机十几天后的今天终于见面了，这么繁忙的物流，不容易，旧式的熨斗太麻烦，一直想享受一下新事物，这挂烫机心想&middot;要买就买个好的吧，还是信任飞利浦这个品牌，趁双十一的优惠价格就出手了，对这新东西还是充满好奇，今天刚收到，还来不及装好，我也是准备拿到孩子哪里去用的，因此就先不装配了，因此晒图也就是严谨的包装，完美无损的各个零件，做工还是很细致的，整个机器的颜值还是很高的，使用的效果等装好使用就来补充吧&middot;
2018-06-06 19:40:53,颜色分类:金色,儿子说不错
2017-11-16 15:01:30,颜色分类:金色,外观设计美观大方，实用便利，很好用的一款
2017-11-24 19:22:54,颜色分类:金色,好用
2018-09-21 12:58:56,颜色分类:金色,好
2018-04-07 07:38:33,颜色分类:金色,还没开始用，待追评
2018-02-08 12:13:10,颜色分类:金色,还可以
2017-12-26 19:06:06,颜色分类:金色,此用户没有填写评论!
2018-04-26 11:33:16,颜色分类:金色,老姐给的链接，确实好用，外表看起来高大上，比之前买的棒子国的好多了，蒸气出的快，大，一件衣服，轻轻松松几下就搞定了。
2018-11-15 10:14:06,颜色分类:金色,双11买的已经收到，发货快质量非常好，蒸汽大，客服服务非常好
2018-11-18 22:00:47,颜色分类:金色,喷雾大，手感好，水桶装水不漏，非常不错
2018-04-13 13:44:35,颜色分类:金色,汤衣服效果很好，安装也很简单。店家有问必答。客服回复也很及时。靠谱！喜欢的亲可以入手！
2018-09-16 20:29:45,颜色分类:金色,终于收到我需要的宝贝了，东西很好，价美物廉，谢谢掌柜的！说实在，这是我淘宝购物来让我最满意的一次购物。无论是掌柜的态度还是对物品，我都非常满意的。掌柜态度很专业热情，有问必答，回复也很快，我问了不少问题，他都不觉得烦，都会认真回答我，这点我向掌柜表示由衷的敬意，这样的好掌柜可不多。再说宝贝，正是我需要的，收到的时候包装完整，打开后让我惊喜的是，宝贝比我想象中的还要好！不得不得竖起大拇指。下次需要的时候我还会再来的，到时候麻烦掌柜给个优惠哦！
2018-08-27 21:35:55,颜色分类:金色,喜欢的，比平常用的要好些，设计大气上档次，挂上就停出气方便，最大亮点是不用除垢，冲着这个卖点来买的。
2017-11-19 19:50:58,颜色分类:金色,还没有呢
2017-12-12 23:30:06,颜色分类:金色,此用户没有填写评论!
2017-11-17 01:40:54,颜色分类:金色,还不错，熨烫方便。比以前买的其他品牌三百多的好，一分价钱一分货。
2017-11-19 00:44:21,颜色分类:金色,老妈非常喜欢
2017-11-28 13:27:38,颜色分类:金色,还没打开，应该没错吧，之前家里用过一个飞利浦的，蛮好用的！
2018-11-17 12:36:11,颜色分类:金色,东西收到了，物流很快，东西很漂亮！也很好用，蒸汽很大！真的很好呢！
2018-12-19 20:10:02,颜色分类:金色,东西很好，使用简单，蒸汽强劲
2018-06-16 17:50:31,颜色分类:金色,东西不错，加热快，需要练习练习。后来客服态度很好，因为七天内降价了，也给退了差价。
2018-12-04 16:10:29,颜色分类:金色,用了真心不错，就是不太好移动，烫衣服很好（为了凑足80字，请忽略。为了凑足80字，请忽略。为了凑足80字，请忽略。为了凑足80字，请忽略。为了凑足80字，请忽略。为了凑足80字，请忽略。为了凑足80字，请忽略。为了凑足80字，请忽略。
2019-01-27 15:46:42,颜色分类:金色,大牌质量没的说，妈妈很喜欢呢～
2018-10-09 10:46:41,颜色分类:金色,这是一个好评模版，因为本人比较懒，不想每个商品都写写好评，所以特地模仿好友写下这个好评模版。但这个产品无论外形和产品质量都是我喜欢的。如果不喜欢，本人收到东西会很生气，然后这个模版会成为本人喋喋不休的休书，自然不会给好评。给各位淘友一个参考，本产品还是积极的。来自一个慵懒只购物不爱写评语只想赚积分的仙女。
2018-01-30 09:41:36,颜色分类:金色,挺好
2018-06-22 15:46:54,颜色分类:金色,非常好，蒸汽量足，喜欢！
2018-08-08 14:58:51,颜色分类:金色,不错，就是一开始不出蒸汽
2018-05-07 21:20:24,颜色分类:金色,不错，安装简单，价格略高，不知道能用多久，退款迅速，给五星。
2018-06-25 07:38:21,颜色分类:金色,好
2017-12-16 17:18:50,颜色分类:金色,双十一预售买的，到家速度很快，但是机器根本用不了，客服太忙，处理时效太慢了，返回去之后换货，又等了很久，最后客服让把那个退款，重新拍一个，然后按照双十一的价格给我，这个到了之后试了下没什么问题，不知道是我运气不好还是机器质量不过关，反正是一次很差的购物经历。
2018-11-16 07:32:52,颜色分类:金色,非常好，比实体店便宜！
2017-11-27 07:05:59,颜色分类:金色,蛮好用的 不知道赠品在哪 啥时候发
2018-11-14 16:42:52,颜色分类:金色,好不错
2017-11-13 14:46:41,颜色分类:金色,此用户没有填写评论!
2017-12-12 10:29:13,颜色分类:金色,此用户没有填写评论!
2019-03-02 17:48:49,颜色分类:金色,出雾量大，美观实用。
2018-06-05 18:25:20,颜色分类:金色,非常好。
2018-06-13 21:07:55,颜色分类:金色,飞利浦的产品，外观不错，目前还未使用，等周末使用后会继续评论，相信飞利浦的质量
2017-11-22 14:44:00,颜色分类:金色,非常好的挂烫机，试用了，蒸汽很足，熨烫快！
2018-03-13 16:48:33,颜色分类:金色,好东西，值得购买
2018-06-12 10:20:34,颜色分类:金色,真心不错呢 特别好用
2018-11-11 21:26:48,颜色分类:金色,中午就收到货了，今年双十一物流真给力，颜值很高，加水清洗了，还没打豆浆，很喜欢。
2018-06-09 21:42:48,颜色分类:金色,一回来就拆开了，试了一下很好用，蒸汽也大
2018-04-27 19:43:55,颜色分类:金色,挺好的
2018-06-04 11:08:11,颜色分类:金色,刚买了一周不到就降价了，还能说啥？另外就是那些说熨得超平整的，我就想问问难不成你们的打开方式和我的不一样？
2018-12-16 19:31:27,颜色分类:金色,此用户没有填写评论!
2018-06-03 09:59:49,颜色分类:金色,包装特别安全，挂烫机也蛮好，希望以后的效果也特别好。
2018-12-06 01:32:24,颜色分类:金色,还是大品牌好，气足，没试过熨裤线，应该也不会差
2018-07-14 00:00:53,颜色分类:金色,刚刚才用，效果真的很好，32个赞
2017-11-19 00:38:59,颜色分类:金色,很好，家里人很满意，之后还会关注店铺。
2017-11-28 08:54:38,颜色分类:金色,安装成功，有背板再也不怕熨烫不受力了
2017-11-14 10:13:32,颜色分类:金色,家里一直买这个品牌的东西，一直质量不错！双十一，下午就到了，这次到手后一试，不出气，有哒哒的声音，其他正常！售后要求自行到维修站去检测！今天14号再插电一试，出气了，蒸汽量不错！机器这三天在考验什么啊，还是本身的故障。待时间来考验大品牌吧！
2019-03-01 18:23:26,颜色分类:金色,买第二台了
2018-03-31 14:24:31,颜色分类:金色,看起来不错！还没用，用后评价！
