2019-10-10 15:27:04,颜色分类:金色,包装非常严谨。物流很快，价格便宜。这款挂烫机简直是大爱，使用感不错，受热快，比想象中的更好用，蒸汽大，受热非常均匀，几分钟就烫好了，水箱容量很大，高度适中，外观设计简约大方，加水也非常方便，安装简单，客服耐心讲解，衣服容易烫，整体不错，值得购买。颜值也很高，很棒，很划算。必须好评。放心大胆购买！十分满意。
2019-10-04 17:45:08,颜色分类:金色,此用户没有填写评论!
2019-10-05 22:50:34,颜色分类:金色,用了三次来评价。挂烫机很好用！颜值也高，放在家里很温馨。包装到位，里里外外三层纸箱！初次使用对加热时的哒哒声有疑问，售后客服杨桃解答耐心细致，好评！
2019-10-08 20:03:28,颜色分类:金色,心仪这款宝贝很久了，趁着国庆节搞活动，终于买了！发货速度特别快，第二天就到了，晚上赶紧装好，立刻试用了一下，果然喷量大，好用！满意！
2019-10-03 11:51:08,颜色分类:金色,这款挂烫机外观做工精致，品质超好，不愧是一分钱一分货呀！旗靓店的品质就是让人放心👍刚试了下出气均匀排力大，夏装还是冬天厚衣服能轻松搞定，重点是还没有噪音，再说说物流也超快，昨天拍的第二天就到了，总之很满意这款挂烫机，比商场价位优惠好多！轻松购物，上货送门太便捷了👏👏
2019-10-05 18:58:48,颜色分类:金色,刚收到，就迫不及待的装，包装结实，组装简单，蒸气出得也快！想要入手的不要犹豫
2019-10-05 13:20:18,颜色分类:金色,外观材质：外观漂亮，大气。 熨烫效果：熨烫衣服方便，值得购买。 特色功能：五档可选，出气均匀。
2019-10-07 20:17:44,颜色分类:金色,好，可拉长、倾斜30度，方便，好用！作用一个女士，对其安装、外观、使用，都感觉顺手顺心。谢谢cs34和导购41的服务哈！
2019-10-04 19:05:35,颜色分类:金色,第二次购买，质量很好，如果是铝合金材质更显得有档次
2019-09-23 19:48:12,颜色分类:金色,第二次购买了，一直用着很好，帮老妈新装修的房子，也买一个，这样我们在老妈家住也可以衣衫整齐靓丽的上班
2019-10-03 15:57:02,颜色分类:金色,收到以后，就开始熨烫，非常好用。客户杨桃态度特别好，不会装，美女很耐心教，非常感谢。
2019-10-05 20:09:33,颜色分类:金色,很喜欢这台挂烫机，国庆期间有优惠政策，果断的买下来物流也很快，感谢售后客服西柚的耐心解答，非常满意的一次购物👍👍👍
2019-09-25 14:41:22,颜色分类:金色,外观材质：金色大气时尚 年轻人用很合适 熨烫效果：试烫了衬衫 效果确实很好 衣领和袖子都很平整 特色功能：蒸汽喷射功能很赞
2019-10-01 11:33:28,颜色分类:金色,挺好的
2019-09-28 16:26:08,颜色分类:金色,此用户没有填写评论!
2019-10-09 09:34:44,颜色分类:金色,店主很不错，很不错一家店
2019-10-04 13:37:39,颜色分类:金色,客服桔子服务很周到，一些不懂组装的问题，都能很好的帮我解决掉了，并且附上了组装视频。特别的感谢，商品非常的棒，很好的解决了家里的衣物问题，非常值得够买😁😁😁
2019-09-25 14:30:22,颜色分类:金色,从包装到使用都很满意！是一个很大的箱子，装的很结实，足以见得大品牌的用心！ 使用非常方便，烫了几个材质面料的衣服，效果都非常好！ 无论是实力，还是颜值，都是无可挑剔的！
2019-09-21 22:37:42,颜色分类:金色,东西真的很好，第二次购买了，第一个放在老家，重新又买了一个，东东质量也很好，值得购买
2019-09-30 20:43:31,颜色分类:金色,到货马上试了试，宝贝不错，非常给力，好评
