2019-10-10 15:27:04,颜色分类:金色,包装非常严谨。物流很快，价格便宜。这款挂烫机简直是大爱，使用感不错，受热快，比想象中的更好用，蒸汽大，受热非常均匀，几分钟就烫好了，水箱容量很大，高度适中，外观设计简约大方，加水也非常方便，安装简单，客服耐心讲解，衣服容易烫，整体不错，值得购买。颜值也很高，很棒，很划算。必须好评。放心大胆购买！十分满意。
2019-09-23 19:48:12,颜色分类:金色,第二次购买了，一直用着很好，帮老妈新装修的房子，也买一个，这样我们在老妈家住也可以衣衫整齐靓丽的上班
2019-10-05 22:50:34,颜色分类:金色,用了三次来评价。挂烫机很好用！颜值也高，放在家里很温馨。包装到位，里里外外三层纸箱！初次使用对加热时的哒哒声有疑问，售后客服杨桃解答耐心细致，好评！
2019-10-05 18:58:48,颜色分类:金色,刚收到，就迫不及待的装，包装结实，组装简单，蒸气出得也快！想要入手的不要犹豫
2019-10-05 13:20:18,颜色分类:金色,外观材质：外观漂亮，大气。 熨烫效果：熨烫衣服方便，值得购买。 特色功能：五档可选，出气均匀。
2019-10-04 17:45:08,颜色分类:金色,此用户没有填写评论!
2019-10-05 20:09:33,颜色分类:金色,很喜欢这台挂烫机，国庆期间有优惠政策，果断的买下来物流也很快，感谢售后客服西柚的耐心解答，非常满意的一次购物👍👍👍
2019-10-08 20:03:28,颜色分类:金色,心仪这款宝贝很久了，趁着国庆节搞活动，终于买了！发货速度特别快，第二天就到了，晚上赶紧装好，立刻试用了一下，果然喷量大，好用！满意！
2019-10-03 11:51:08,颜色分类:金色,这款挂烫机外观做工精致，品质超好，不愧是一分钱一分货呀！旗靓店的品质就是让人放心👍刚试了下出气均匀排力大，夏装还是冬天厚衣服能轻松搞定，重点是还没有噪音，再说说物流也超快，昨天拍的第二天就到了，总之很满意这款挂烫机，比商场价位优惠好多！轻松购物，上货送门太便捷了👏👏
2019-10-07 20:17:44,颜色分类:金色,好，可拉长、倾斜30度，方便，好用！作用一个女士，对其安装、外观、使用，都感觉顺手顺心。谢谢cs34和导购41的服务哈！
2019-10-04 19:05:35,颜色分类:金色,第二次购买，质量很好，如果是铝合金材质更显得有档次
2019-10-03 15:57:02,颜色分类:金色,收到以后，就开始熨烫，非常好用。客户杨桃态度特别好，不会装，美女很耐心教，非常感谢。
2019-09-30 20:43:31,颜色分类:金色,到货马上试了试，宝贝不错，非常给力，好评
2019-09-25 14:41:22,颜色分类:金色,外观材质：金色大气时尚 年轻人用很合适 熨烫效果：试烫了衬衫 效果确实很好 衣领和袖子都很平整 特色功能：蒸汽喷射功能很赞
2019-10-01 11:33:28,颜色分类:金色,挺好的
2019-09-29 16:57:13,颜色分类:金色,旗舰店的东西呀，确实不错(*๓&acute;╰╯`๓)♡
2019-09-23 09:52:11,颜色分类:金色,相信飞利浦大品牌，特意用过才来评论，蒸汽特别大，店里熨衣服特别多，非常的快，希望越做越好，卖家还赠送口红，好评，推荐大家购买
2019-09-28 16:26:08,颜色分类:金色,此用户没有填写评论!
2019-10-09 09:34:44,颜色分类:金色,店主很不错，很不错一家店
2019-10-04 13:37:39,颜色分类:金色,客服桔子服务很周到，一些不懂组装的问题，都能很好的帮我解决掉了，并且附上了组装视频。特别的感谢，商品非常的棒，很好的解决了家里的衣物问题，非常值得够买😁😁😁
2019-09-25 14:30:22,颜色分类:金色,从包装到使用都很满意！是一个很大的箱子，装的很结实，足以见得大品牌的用心！ 使用非常方便，烫了几个材质面料的衣服，效果都非常好！ 无论是实力，还是颜值，都是无可挑剔的！
2019-09-21 22:37:42,颜色分类:金色,东西真的很好，第二次购买了，第一个放在老家，重新又买了一个，东东质量也很好，值得购买
2019-09-23 14:09:07,颜色分类:金色,特别好，哥哥家在用，非常好，嫂子的衣服都是很有垂感，很羡慕，嫂子说自己每天晚上会把第二天的衣服烫一下，知道后，我就找同款，这次看到有活动，我就买了，价格很便宜，飞利浦牌子很好，牙刷用的它家，这次挂烫机看包装就很让人贴心，费心了亲爱卖家，我都迫不及待没有安装就来评价了，后期会追加图片！物流完美，客服也很完美，点赞
2019-10-03 23:24:26,颜色分类:金色,这机器开机等待加热时间短，机子移动方便，马力足，就是蒸汽足，不错，烫衣服关键是这个。
2019-09-27 21:35:37,颜色分类:金色,物有所值，档位多方便，对任何衣服没有损坏！值得推荐！客服优秀！
2019-09-27 13:03:31,颜色分类:金色,比以前的好用多了，值！
2019-09-23 06:08:34,颜色分类:金色,全非常愉快的一次购物，质量很好，价格也合适，诚信，如果在购物时发生客服会积极解决，每次购物最好给些小赠品，非常好，这段时间都不去超市了，每天在网上购买生活必须品，超市品种全，价格低，天天买买买，都成了忠实客户ⅤlP了，衣服，鞋子，生活用品，统统送到家！]
2019-09-28 16:51:20,颜色分类:金色,好安装、功率大，很满意
2019-09-22 15:58:17,颜色分类:金色,三层纸箱包装～高大上！看了示意图很轻松就安装好了；蒸汽量有五档选择（手柄上就可以操作）；2L水箱够大；可30度倾斜撑杆，熨烫时不用弯腰。熨烫了几件衣物效果不错。
2019-09-30 21:53:47,颜色分类:金色,第二台了 颜值也高也方便平铺熨烫也可以挂烫
2019-09-27 13:40:39,颜色分类:金色,外观材质：材质不错，款式也很靓！ 熨烫效果：用了两次非常好用，质量棒棒哒👍
2019-09-21 11:17:27,颜色分类:金色,飞利浦挂烫机质量非常好，颜值高，包装仔细，安装便捷，熨烫效果好，五星好评！
2019-09-20 21:19:58,颜色分类:金色,包装严谨 物流超快 宝贝安装方便 外观漂亮 出气均匀 熨烫衣服方便 推荐购买
2019-09-25 12:43:28,颜色分类:金色,外观材质：很好，还没有用，等用过了再追评。
2019-07-14 08:05:39,颜色分类:金色,此用户没有填写评论!
2019-09-24 08:18:51,颜色分类:金色,很好用，
2019-09-09 22:52:05,颜色分类:金色,车厘子服务非常周到 产品质量不错
2019-09-26 00:00:05,颜色分类:金色,非常好用
2019-09-14 17:33:09,颜色分类:金色,挂烫机颜值超级高，拼接很轻松，价格杠杠的，我很满意，很稳定用起来，蒸汽目前没有发生漏水，使用起来很安全，在用的时候挂上自动停止蒸汽，要是长时间不用也会自动断电，超级好的，烫衣板的设计也很人性化，满意
2019-09-22 15:07:49,颜色分类:金色,东西非常好，试一下很好用，五分好评。
2019-09-21 17:06:31,颜色分类:金色,颜色蛮好看的简单大气，熨烫效果还可以，可以满足基本要求，加热速度很快，烫的时候一定要尽量保证手柄在垂直状态，不然水滴下来真的很烫😭 物流超快前一天大晚上下单，第二天上午就到了~
2019-09-12 21:00:30,颜色分类:金色,大功率 精确五个档位 带滑轮移动更方便～
2019-09-12 21:26:19,颜色分类:金色,与店铺描述一样
2019-09-21 11:59:04,颜色分类:金色,特意用过后来评价，确实超级好用
2019-09-21 21:56:48,颜色分类:金色,值得信赖的品牌，非常棒👍🏻
2019-09-22 21:59:30,颜色分类:金色,设计很人性化，用着还可以，试用一段时间后如果没问题，还会介绍其它朋友购买的。卖家发货快，物流快，给好评。
2019-09-22 19:31:40,颜色分类:金色,特别好的设计！
2019-09-22 16:38:49,颜色分类:金色,很好用，熨烫效率很高，很值得入
2019-09-21 18:57:35,颜色分类:金色,收到了，就来试用，非常强大，好用
2019-10-08 17:25:21,颜色分类:金色,特色功能：不错，一直在用没有出现问题。
2019-08-28 20:28:53,颜色分类:金色,此用户没有填写评论!
2019-09-13 18:27:44,颜色分类:金色,外观很nice，不错，很喜欢。
2019-09-13 18:44:59,颜色分类:金色,此用户没有填写评论!
2019-09-18 22:59:55,颜色分类:金色,外观材质：好看 熨烫效果：轻松
2019-09-11 17:13:16,颜色分类:金色,超级好，拿回来就开始熨烫了，很方便，熨烫完的衣物板板正正的感觉生活变得有质感了！不可或缺的家电之一！
2019-09-18 12:49:09,颜色分类:金色,非常高大上的产品，送给闺蜜的结婚礼物，并且店家非常用心的装了三层纸箱，非常牢固，闺蜜拿到手后迫不及待的熨烫了她的礼服，非常好用，并且活动买的，非常划算，物流速度很慢，但是派送的小哥哥很给力，还帮我们搬上楼，点赞笔芯哦👍🤗
2019-09-09 15:34:05,颜色分类:金色,熨烫效果：不错啊。实体店要两千多！看到淘宝一千头！果断付款！不错不错！
2019-09-21 08:53:22,颜色分类:金色,很好用的挂烫机
2019-08-09 18:58:09,颜色分类:金色,外观材质：外观好看 高端有档次 熨烫效果：熨烫效果好 带板操作方便
2019-08-31 22:10:23,颜色分类:金色,东西真的很好，比我以前买的产品都好，物超所值，已经烫了好多衣服，效果棒棒的
2019-08-27 20:28:27,颜色分类:金色,宝贝非常漂亮，收到之后就使用了。效果和颜值爆表了！！满意！！尤其客服柠檬服务态度很好，效率高！感谢！
2019-08-07 11:51:34,颜色分类:金色,速度很快 送货上门 特意烫件衣服 好用
2019-09-20 10:35:44,颜色分类:金色,宝贝很漂亮的，看了好多家，才选择天猫旗舰店飞利浦的，以前买过一个是别的大品牌贝尔莱德的，总是坏，所以选一个靠谱的价格高点的，慰烫的效果也不错，挂衣板也很方便还是不错的！宝贝是高大尚的！
2019-09-05 21:49:48,颜色分类:金色,很好用，买的第二个了，全家人都喜欢！
2019-09-09 11:08:51,颜色分类:金色,包装的很好
2019-09-02 22:23:55,颜色分类:金色,给姐姐买的，她很喜欢。好评。
2019-09-03 16:43:50,颜色分类:金色,非常好的一款产品！
2019-09-05 11:09:39,颜色分类:金色,此用户没有填写评论!
2019-08-24 10:47:05,颜色分类:金色,刚刚收到，还没有使用，看外型功率觉得应该是好用的！
2019-09-07 22:34:01,颜色分类:金色,物流超级快！客服人员36号热情周到！好评
2019-09-05 10:11:39,颜色分类:金色,非常喜欢该款机器，功率大，出气块，更惊喜的是还有自动停息功能！用过4款挂烫机了，这款最喜欢，而且客服杨桃帮助许多，特别鸣谢！
2019-10-03 23:17:41,颜色分类:金色,同事推荐的，收到后试了下，熨了衬衣和羊毛大衣，效果都不错。刚开始打开的时候有些水汽，把喷头举高几秒钟再熨就好多了。终于不用再穿皱巴巴的衣服了。希望耐用～
2019-08-30 12:30:38,颜色分类:金色,是我喜欢的款，蒸汽有力，功率大就是省力！很好👌🏻
2019-09-09 20:45:15,颜色分类:金色,炒鸡好用，小巧不占地方，板子很实用，赞
2019-09-03 21:00:00,颜色分类:金色,灰常的好用，有个板就是革命，谢谢卖家，希望做好售后，继续给你介绍客户，买了两个了
2019-09-03 15:41:28,颜色分类:金色,【CS9棒棒哒】 表扬一下【CS9】的哦！上次买了一个便携式的很好用，这次还没用，相信你们的产品！
2019-09-06 14:08:24,颜色分类:金色,质量好，不滴水
2019-08-26 20:10:23,颜色分类:金色,果然是品牌设计人性化，实用
2019-08-29 22:42:38,颜色分类:金色,客服cs33非常有耐心点赞
2019-09-02 13:35:53,颜色分类:金色,CS13棒棒哒
2019-09-04 08:20:01,颜色分类:金色,一直用的都是飞利浦熨烫机   好评~
2019-08-02 16:37:12,颜色分类:金色,去实体店看了一下，选择在旗舰店买的。相当好用。而且价格非常优惠。熨烫了一下，感觉棒棒哒。值得信赖。五分钟安装(ღ˘⌣˘ღ)熨后效果明显。
2019-08-11 17:20:21,颜色分类:金色,一直信任飞利浦的产品质量，看着就漂亮，使用简单方便
2019-08-09 20:28:26,颜色分类:金色,哇，非常赞，大品牌，看过实体店再来的，更优惠！有了这个家里衬衣再也不担心了
2019-08-11 10:43:07,颜色分类:金色,收到货立马安装好，试熨了一下衬衣，效果不错~物流也快，很快就收到货了~
2019-08-22 17:01:31,颜色分类:金色,很人性化的设计，不愧是大牌。
2019-09-01 19:44:02,颜色分类:金色,第二次买飞利浦的挂烫机了，几年前也买了台高端机，这台更先进了，自动除水垢，实在好用。
2019-09-12 13:10:10,颜色分类:金色,熨烫效果：以前的熨烫机用了超过十年了 就是往下滴答水 所以决定重入一个 大品牌的东西值得信赖
2019-08-11 16:52:37,颜色分类:金色,包装完美，三层包装保护保驾护航，挂烫机颜色漂亮做工精细，不愧是值得信赖的大品牌产品。特别表扬客服CS2 ，服务热情，不厌其烦耐心细致解答每一个问题，为客服CS2点赞
2019-10-04 17:47:26,颜色分类:金色,此用户没有填写评论!
2019-08-05 18:18:47,颜色分类:金色,开包马上安装上，很好安装。蒸汽很大。
2019-08-05 11:33:19,颜色分类:金色,东东很漂亮，收到后试用了一下，感觉很好
2019-08-20 00:11:45,颜色分类:金色,挂烫机高端大气，衣物烫的很平，很好用，很方便，喜欢
2019-07-14 10:07:31,颜色分类:金色,此用户没有填写评论!
2019-07-31 17:11:44,颜色分类:金色,快递送货上门，收到宝贝马上安装就用上了，非常满意。
2019-08-23 08:00:15,颜色分类:金色,宝贝收到货就立即试了，功率很大，烫的很平，挺好的，物有所值，全五分
2019-08-19 15:17:51,颜色分类:金色,非常好&hellip;马上用了一下&hellip;杠杠的&hellip;
2019-08-05 11:58:32,颜色分类:金色,简单好用，气量足👍
2019-08-10 22:45:53,颜色分类:金色,果然是一分钱一分货啊！好用好用！强烈推荐大家买这个！快递也很赞哦！
2019-08-04 22:07:29,颜色分类:金色,一直都很信赖飞利浦这个品牌，和其他杂牌的东西不能比，完美。
2019-08-20 17:01:15,颜色分类:金色,宝贝收到，使用起来还不错，很喜欢
2019-08-21 20:55:27,颜色分类:金色,终于等到心仪的挂烫机，安装简单，使用方便，真是值得拥有。
2019-08-01 22:19:36,颜色分类:金色,这款挂烫机用起来非常好用，出气量控制好，熨烫效果非常好，衣服很平整，特别是cs12的服务到位，耐心解答疑惑，非常的贴心。
2019-08-20 14:12:13,颜色分类:金色,此用户没有填写评论!
2019-09-30 15:16:43,颜色分类:金色,外观材质：外观可，试用了一下熨衣服也行，比较一下实体店，价格有点贵！
2019-09-06 14:09:15,颜色分类:金色,听朋友介绍这款蒸汽熨衣服的机器，感觉真好用！非常不错哦！物流 、包装好；操作简单方便，非常非常好！满意100分！哦，稍微有一点点小缺点，就是有一点点水滴会偶尔滴在衣服上，不知道是自己用的方法问题吗？反正才用一次，后面在看看！
2019-08-07 13:54:37,颜色分类:金色,老婆很满意
2019-08-20 10:51:32,颜色分类:金色,此用户没有填写评论!
2019-08-22 14:40:31,颜色分类:金色,蒸汽很足，总体来说挺好用的
2019-08-04 22:17:16,颜色分类:金色,挺好安装，正在熟悉使用，应该好用吧。用完再追评！
2019-08-22 04:57:50,颜色分类:金色,东西好漂亮，还未使用，客服cs25服务非常好，耐心解释，感谢！，
2019-08-11 11:25:30,颜色分类:金色,很好
2019-08-02 15:11:48,颜色分类:金色,挂烫机质量非常好，客服cs1服务周到，热情，值得推荐和购买，为商家点赞！
2019-07-31 20:25:23,颜色分类:金色,东西非常好用，物有所值！
2019-08-18 11:30:42,颜色分类:金色,安装简单，使用方便，极速发货。
2019-08-22 16:25:57,颜色分类:金色,很好，质量好颜色好，带有熨烫板很方便
2019-08-12 17:12:55,颜色分类:金色,好用，与商场的一致
2019-08-11 10:25:34,颜色分类:金色,东西不错 cs13客服很赞
2019-07-31 15:47:47,颜色分类:金色,宝贝收到了，感谢导购36的耐心服务，后期用过再评价
2019-08-19 11:15:49,颜色分类:金色,方便好用哦！
2019-08-12 10:48:52,颜色分类:金色,好评，还没用，等用了再做评价。
2019-08-11 12:53:25,颜色分类:金色,还不错，用起来挺好的，好评
2019-08-22 14:24:24,颜色分类:金色,客服CS19态度超好，谢谢你
2019-06-07 22:05:54,颜色分类:金色,发货速度很快，拍下的当天下午就发货了，包装很严实，用两个厚箱子装着，丝毫不用担心运送到会有破损的情况。安装简单，两个箱子上以及说明书上都有详细的安装步骤，简单容易上手，大概10分钟一个人就能组合完毕，刚才接了水用了一下，蒸汽很足，熨烫平时穿的衣服绰绰有余了反正，烫衣架还能30&deg;倾斜，整体还不错，颜值很高，值得购买。很好很好很好很好很好很好很好很好很好很好很好很好很好很好很好很好很好很好很好很好很好很好很好很好很好很好很好很好很好很好很好很好很好很好很好很好很好很好很好很好很好很好很好很好很好很好很好很好很好很好很好很好很好很好很好~
2019-08-01 10:01:59,颜色分类:金色,还没开始用，等用了在来追评
2019-08-08 19:42:29,颜色分类:金色,还没用，感觉挺好的
2019-06-17 14:58:20,颜色分类:金色,发货快，东西到家先安装好，外观漂亮，待以后使用再评论，我现在用的就是这产品，相信会好用的。
2019-07-11 17:34:09,颜色分类:金色,宝贝非常漂亮，效果特别好，没有噪音，设计舒适感非常强，站、坐熨烫都很舒适，出气量控制方便，熨衣快速平整，非常满意的一次购物。
2019-06-19 19:22:12,颜色分类:金色,终于装好了，好累，包装很用心
2019-08-09 21:47:33,颜色分类:金色,发货快，用上了，不错。不过第一次一定要记得多按下开关才行。
2019-06-05 21:50:54,颜色分类:金色,确实很好用，比之前的挂烫机要烫的平和快，确实一份价钱一分货，高大尚，很满意。
2019-07-12 09:47:08,颜色分类:金色,外观材质：很好，用料实在 熨烫效果：完美 特色功能：手持部位按钮方便，熨衣板安排周到 家里有一款了，这一次趁着活动再弄一个，划算
2019-08-10 22:46:45,颜色分类:金色,外观材质：结实易安装，实物比图片好看一些。 发货物流很快，包装结实。 占地不大，就一个凳子的面积。 还没用，送给姐姐作新婚礼物的。相信飞利浦的品质。
2019-07-13 20:02:36,颜色分类:金色,大品牌就是高大上，做工材质都非常好、蒸汽足，熨衣服很快，服装店使用很方便，推荐
2019-07-02 18:53:30,颜色分类:金色,到货后试了一下，效果非常好，五档蒸汽调节，适合不同材质的衣服，烫衣板的弧度也很合适，烫衬衫又快又好。中间产生一点小疑问，客服桔子很快帮忙解决了，服务态度很好。
2019-06-28 19:56:19,颜色分类:金色,之前买的一款挂烫机马力不足，麻材质的褶皱根本熨不平，然后在顺电看到的是飞利浦另一款，型号不记得了反正价格不便宜，也没有活动。后来到天猫种草了这款，正好618大促，很划算，然后就拔草啦。用了一周的时间特意来评价：水箱容量够大，蒸汽量足足的，很省水，功率又大，出蒸汽口不漏水，100分，完美！
2019-07-25 21:21:04,颜色分类:金色,没收到货心里还是担心质量问题，收到后感觉还不错。昨天晚上拍的，今天下午就收到了。下午烫了一条真丝裙子和一条蕾丝裙子，另外还烫了一件双面呢，宝贝很好用，希望后期宝贝不要让我失望。另外要表扬客服20，很有耐心，客服34服务态度有待提高！
2019-07-23 15:58:20,颜色分类:金色,外观材质：材质不错，外观满意 熨烫效果：使用了几次，熨烫效果好，而且使用起来很方便 包装很用心，装了三层箱子。
2019-07-03 13:10:53,颜色分类:金色,一直使用飞利浦的东西 都好用 质量没问题，物流快，用起来也很好
2019-07-27 15:45:59,颜色分类:金色,熨烫效果：熨烫效果不错，出蒸汽特别快，手持起来也不沉，特别好用的感觉
2019-07-28 16:09:01,颜色分类:金色,非常友好容易安装，稳固方便颜值高
2019-06-13 12:14:38,颜色分类:金色,家里非常满意
2019-07-14 17:18:35,颜色分类:金色,这款产品很不错，比以前买的要方便多省力
2019-07-11 22:52:38,颜色分类:金色,这款挂烫机好漂亮，非常喜欢，用起来得心应手，值得购买！
2019-09-24 23:16:32,颜色分类:金色,接待我的CS6 客服上辈子应该是只🐟 解释说明不到位  服务态度不积极 回复不及时 本应早上就下单才买、一只拖到下午四点多解释清楚 说了要投诉才开始积极服务 CS6 你该下岗了
2019-07-20 13:46:33,颜色分类:金色,吹风机和挂烫机两个一起下单，刚开始不会使用，在客服cs23和木瓜细心的指导下能运用自如了，给她们周到的服务加满分👍，飞利浦是个大品牌，后期还会继续光顾😊。
2019-06-22 10:10:26,颜色分类:金色,心仪已久的挂烫机终于到了，五种调节功能，试烫了一件，真的太赞了👍，再说一下德邦物流，那么大一箱，扛到5楼，辛苦了，服务一流👍
2019-07-28 17:52:02,颜色分类:金色,外观材质：质感不错，操作也很方便 熨烫效果：熨烫立刻起效，效率很高
2019-07-11 21:26:48,颜色分类:金色,值得拥有，梅雨季节心情压抑，简单安装完毕，随手真丝、麻料衣服分分钟让心情美丽起来，花钱真能买乐
2019-07-13 17:20:10,颜色分类:金色,宝贝非常的好，物流很快，熨衣服非常快。我和女儿组装，15分钟基本完成。非常开心。
2019-07-04 11:10:10,颜色分类:金色,618买到的，价格实惠，用过一次，质量也好！五星好评！
2019-07-11 09:35:50,颜色分类:金色,拍下很快就收到了，外观上档次，安装方便熨烫效果很满意
2019-08-12 11:42:29,颜色分类:金色,挂烫机好用，薄衣服效果比较明显，秋冬衣服还没试，相信飞利浦的品质
2019-07-20 04:53:05,颜色分类:金色,外观时尚，蒸汽量大，熨过衣服效果很好👍喜欢😘
2019-07-15 17:43:04,颜色分类:金色,好
2019-07-16 15:30:32,颜色分类:金色,产品质量很不错，外观也很漂亮，试了一下，烫的衣服很平整，品牌值得信赖，CS33客服服务也很周到
2019-07-24 22:30:45,颜色分类:金色,刚好家里需要一台挂烫机，看到宝贝有优惠活动的力度还好就买了，我又不在家，还是隔壁家帮帮收货了，拍照片，确实真心喜那款赠品手持吸尘器，希望卖家给予支持！用了还追评！谢谢🙏
2019-09-10 12:14:09,颜色分类:金色,家里以前一款用了很多年了，想着更新换代又买了一台 ，外观材质都一如既往的好，新的这款烫衣服有了烫衣板比老式方便了很多很多，值得表扬还有售后的木瓜，非常热心周到，大品牌就是值得信任。
2019-07-04 16:58:08,颜色分类:金色,非常不错的购物，之前一直在观望，没有让我失望，不错的物品
2019-07-10 18:10:02,颜色分类:金色,满意满意，非常好用，也不占太大地方，用起来太方便了！在这里表扬一下导购36号 态度好，热情，赞一个！
2019-07-27 21:29:14,颜色分类:金色,这款挂烫机用起来非常的方便，功率大烫出来的衣物非常平整，高端大气上档次！客服的服务态度也特别的好！特别是cs31服务到位，耐心解答疑惑，非常的贴心！
2019-07-29 09:21:26,颜色分类:金色,外观材质：满意 熨烫效果：很好
2019-07-20 20:23:53,颜色分类:金色,真不错 大厚窗帘都能熨开
2019-07-04 09:26:26,颜色分类:金色,很不错的东西，五分
2019-08-20 08:53:12,颜色分类:金色,我每个月林林总总要买很多东西，如果逐一评价我会很崩溃，所以特别制作一下，当你看到版这段话的时候，说明我对此产品很是满意，后来者可以放心大胆的购买，当然我并非一个不负责任的买家，如果产品不好，我也会花一番功夫来好好评论番的!
2019-07-11 14:59:24,颜色分类:金色,东西收到。物流很快  包装到位   质量令人满意  很愉快的一次购物。相信品牌的质量
2019-07-26 09:40:21,颜色分类:金色,我自己就装好了，发货快送上门，宝贝看着就舒服，还没有用等用了再追评！
