2018-11-29 22:43:42,颜色分类:金色,"非常好，与卖家描述的完全一致，非常满意,真的很喜欢，完全超出期望值， 发货速度 非常快，包装非常仔细、严实， 物流公司服务 态度很好，运送速度很快，很满意的 一次购物。 ￼"
2018-09-15 07:14:52,颜色分类:金色,有点滴水
2019-01-11 18:28:20,颜色分类:金色,好用
2018-10-01 15:19:09,颜色分类:金色,很高大尚的一款，这是回购的，用起来还不错👍，外观颜色挺喜欢
2019-01-23 21:42:37,颜色分类:金色,简单好安装，好用！
2017-11-13 16:12:02,颜色分类:金色,这个好人性设计，买！
2018-03-14 15:09:05,颜色分类:金色,做工没以前的好
2017-11-19 15:28:56,颜色分类:金色,效果很好，非常好用
2017-12-01 08:05:21,颜色分类:金色,"双十一价格实惠，就是不知道赠品什么时候发货，非常满意,真的很喜欢，完全超出期望值，发货速度非常快，包装非常仔细、严实，物流公司服务态度很好，运送速度很快，很满意的一次购物"
2018-11-26 10:44:30,颜色分类:金色,非常好，五+1档蒸汽给力，平铺传统熨斗不需要了🌹🌹🌹
2018-06-08 22:13:04,颜色分类:金色,效果棒棒哒👍👍👍
2018-07-14 18:39:54,颜色分类:金色,此用户没有填写评论!
2018-12-04 09:49:29,颜色分类:金色,种草很久总算是拔草了，从此不再担心衣服皱巴巴的了，物有所值，就是价格有点高！
2018-01-09 23:52:37,颜色分类:金色,蒸汽量很大，效果好。
2019-03-19 20:09:50,颜色分类:金色,质量非常棒，是正品，特别好安装，邮回来老公就安上了，立刻拿衣服试了，不喷水，蒸气力也大，客服态度也好，很有耐心滴解释问题，如果有需要的，会再次回购的。点赞👍
2018-12-13 10:54:11,颜色分类:金色,此用户没有填写评论!
2018-05-18 19:28:24,颜色分类:金色,不错，好用！
2018-01-19 15:15:13,颜色分类:金色,差评，不值这个价钱，而且说好的发票也没有
2018-04-09 13:02:04,颜色分类:金色,挺好的新家还没用，以后追评
2017-12-22 11:31:29,颜色分类:金色,一直是飞利浦的粉丝，家里电器都是飞利浦的。其它大电器都是海尔的
2018-10-05 08:29:49,颜色分类:金色,你是不是差我一加湿器没给我呀，
2018-05-03 14:55:59,颜色分类:金色,好！
2018-10-11 11:56:42,颜色分类:金色,朋友推荐的，果然一分价钱一分货，安装方便，蒸汽大，垫板可倾斜，熨烫更方便，发货速度超级快，第二天早上就收到货，包装也很好，用了三个盒子套起来，很严实。希望这个的使用寿命能长一点。
2017-11-26 09:58:39,颜色分类:金色,熨烫效果不错，温度也快。
2017-12-09 21:34:29,颜色分类:金色,此用户没有填写评论!
2019-04-12 01:25:55,颜色分类:金色,不错的一次购物。飞利浦绝对值得信赖。特别感谢CS11服务态度周到，有问必答。我翻了一下评价记录。说这个店服务差。但我亲身体验刚开始是忐忑的。但一开聊。态度根本不像评价说的不回话啊什么的。绝对是立即回复。我觉得此店值得信赖。这个挂烫虽然贵点。但买的放心。还能说点什么呢。家里基本都是飞利浦小电器。这几天熨了些衣服。真的给力。有点喜欢熨衣服了。哈哈。行了。不说吧。不知道字数够不够。也不懂积分怎么来。就这么打字说说感受就好。不喜勿喷。再次感谢CS11。表扬表扬。希望态度都像他那样。
2018-03-13 09:47:30,颜色分类:金色,刚买完就便宜100多，还有赠品，哎买早了，不过质量没得说
2018-10-18 14:31:41,颜色分类:金色,非常好
2018-11-18 12:14:16,颜色分类:金色,好用
2017-11-22 22:38:20,颜色分类:金色,还不错，就是板子不能放下来，有点鸡肋
2017-11-25 09:57:42,颜色分类:金色,非常不错，高大上！熨完大衣的大衣展展的～～
2018-11-14 23:19:26,颜色分类:金色,外观设计很大气 试用了一下效果很不错 价格比实体店优惠好多 推荐～～
2019-01-20 13:08:34,颜色分类:金色,宝贝包装非常严实，还放车房没开始用。希望好使。
2018-11-20 07:54:24,颜色分类:金色,好评
2018-07-19 12:23:15,颜色分类:金色,此用户没有填写评论!
2018-11-15 22:08:01,颜色分类:金色,"用的还不错，比烫斗来的快，方便很多就是太皱的还是要熨斗,也不是很占地方"
2019-03-28 11:26:46,颜色分类:金色,妈妈说宝贝不错哦，已经在使用中，表扬一下CS19客服哦
2017-12-11 16:17:36,颜色分类:金色,此用户没有填写评论!
2017-11-18 00:25:35,颜色分类:金色,还可以吧，距离期望还是有点距离，赠品还没有收到，期待赠品吧
2019-02-18 12:38:28,颜色分类:金色,东西已经收到了，包装的很严实，还没开始使用，不过看起来质感不错。等使用后追加评价！
2017-12-12 03:29:46,颜色分类:金色,此用户没有填写评论!
2017-12-26 15:44:56,颜色分类:金色,一分价钱一分货，熨烫效果真好
2018-07-08 10:10:59,颜色分类:金色,商场标价2千多！买不起！还是天猫官网价格实惠！高大上！
2018-11-27 16:18:19,颜色分类:金色,挂烫机是我妈指定要买的款，送的个毛球修剪器我妈也很喜欢 还可以
2018-10-03 07:47:24,颜色分类:金色,好用
2018-06-19 12:40:40,颜色分类:金色,非常好用的蒸汽熨斗，一烫就平整
2018-11-19 16:17:51,颜色分类:金色,好
2018-11-25 00:07:17,颜色分类:金色,质量确实不错！到底是大品牌！值得购买！双十一挺优惠的！专柜这款买二仟多！就是客服双十一没人回话！很不方便！
2018-06-04 18:41:44,颜色分类:金色,发货很快，三层纸箱包装严实，很好安装，试用了一下，还不错，贴着墙角收起来不占地方
2018-04-09 21:54:49,颜色分类:金色,很好用，又买了一个送朋友
2018-04-11 21:43:36,颜色分类:金色,满意
2018-11-18 22:35:15,颜色分类:金色,组装的也不算麻烦，质量还可以，装好还没用，用过之后再说使用效果如何吧
2018-05-21 15:06:11,颜色分类:金色,金色很漂亮！
2018-02-07 23:21:12,颜色分类:金色,使用了，挺好
2018-05-30 17:42:43,颜色分类:金色,贵有贵的道理，秒杀家里之前的老款，好用太多了，必须手动点赞👍
2018-10-27 11:41:34,颜色分类:金色,因
2018-08-04 20:20:07,颜色分类:金色,好
2018-11-25 16:31:38,颜色分类:金色,挂烫机很好用，现在不怕机洗的衣服皱巴巴的了
2018-03-30 09:04:20,颜色分类:金色,好看
2018-02-06 21:24:17,颜色分类:金色,还没拆封，应该是可以的，。拉拉拉拉拉拉拉拉裤，我也想啊嗯哈我也想吃火锅啊你说什么就是什么时候啊哈哈哈啊你怎么知道的我还是觉得那个时候你在哪个教室了吗好的哈哈哈哈哈我觉得自己已经到了打电话问问看你们怎么想
2018-12-12 14:04:46,颜色分类:金色,此用户没有填写评论!
2018-05-28 05:06:40,颜色分类:金色,👌
2018-10-22 11:49:23,颜色分类:金色,"质量非常好，与卖家描述的完全一致，非常满意,真的很喜欢，完全超出期望值，发货速度非常快，包装非常仔细、严实，物流公司服务态度很好，运送速度很快，很满意的一次购物"
2018-05-19 20:12:53,颜色分类:金色,此用户没有填写评论!
2019-03-21 18:12:35,颜色分类:金色,好用。蒸汽很足，烫板方便。华丽丽的分割线：我是我们村第一个在网上上买东西的人。这里大部分人是不网购的。他们买东西价格一般不超过五块，听说我在网上买东西后，整个村都震惊了，村长跑到我家里对我爸说我是不是疯了? 说这日子没法过了，让我出去租房子住，面对重重压力，我坚持要买。我相信我这个月的工资不会白花，终于快递我怀揣着激动的心情，颤抖的打开包裹，那到了，感觉我的眼都要亮瞎了，啊..这颜值、这一霎那，手感、这质量、只怪我读书少，无法用华丽的语言整个村都来形容它。我举着它，骄傲的站在村口，他们就跳井，吓得我赶紧收起宝贝，挤出人群落荒而逃。为测试我立刻去我们村高达100米山上村长家客厅里测试宝贝效果，用完后，在全村人羡慕的目光中，仰首挺胸扬长而去。
2018-08-08 18:25:45,颜色分类:金色,棉质的衣服烫的效果马马虎虎吧。其它材质的应该够用
2019-02-15 19:00:15,颜色分类:金色,看着感觉好，用了再评价！
2018-05-12 00:39:05,颜色分类:金色,不错好用。
2018-02-02 17:51:35,颜色分类:金色,外观大气.很好。
2018-11-26 09:01:42,颜色分类:金色,双十一买的不错 功率大还能调档 物流也挺快的 发货也快
2018-11-22 21:31:35,颜色分类:金色,挂烫机昨天下午收到，包装很好三个纸箱装的，今晚拿来用很好用，很满意的一次购物，就是还有三个礼品没有到，物流太慢了10天才收到货，要下手的亲们赶快下手，下次还有需要再来。
2018-09-25 19:17:03,颜色分类:金色,非常漂亮，好用
2018-06-06 10:37:51,颜色分类:金色,淘宝几年才知道原来评论85个字才会有积分。所以从今天到以后，这段话走到哪里就会复制到哪里。首先要保证质量啊，东西不赖啊。不然就用别的话来评论了。不知道这样子够不够85个字。谢谢老板的认真检查，东西还挺好的。我不是刷评论的，我是觉得东西好才买。你会发现每一家都是这么写的，因为复制一下就好了。
2018-11-16 18:47:05,颜色分类:金色,好用，设计合理-出气量大
2018-12-19 12:31:02,颜色分类:金色,挂烫机收到，安装简单，外型美观，质感好，我烫了一件衣服，效果很好。客服态度好！物流快！
2018-01-22 08:06:03,颜色分类:金色,非常实用，喜欢
2018-12-15 01:06:35,颜色分类:金色,此用户没有填写评论!
2018-08-11 16:57:20,颜色分类:金色,【cs2超级棒】服务杠杠的加油加油
2018-11-16 00:20:47,颜色分类:金色,装好试了一下，正常，烫、烫、烫。
2018-12-04 21:31:29,颜色分类:金色,宝贝很不错，很好，很满意，一直相信飞利浦这个品牌，希望不要让我失望，会推荐给朋友买的，客服人很好，很耐心的回答我的问题～～～
2019-03-16 23:53:48,颜色分类:金色,看上去不错，高大上，值得一提的，我拼不起来&hellip;，我六岁的儿子拼起来的，看来三岁起开始拼乐高看图纸学习机器人课程，还是有用处的。
2018-12-18 13:17:32,颜色分类:金色,快递包装很严实，弄了两层纸箱，就是快递没有送上门，自己去驿站取的，太重了闪了腰&hellip;蒸汽量很大，90秒就能加热好，超过8分钟不使用还会自动停，挺好的
2018-12-03 09:20:29,颜色分类:金色,我老公说从物业拿过来很大很重的一个箱子  大箱子里面还有个挂烫机的外箱  包装真的很牢固  这款双11确实比平常便宜  还没开始用 看上去比较不错
2018-03-27 00:13:44,颜色分类:金色,半个月了，不知道送的东西什么时候能到
2019-03-22 21:47:44,颜色分类:金色,买回来到现在也没有组装😂好大一个箱子，性能外观什么的等用了之后再说。买回来到现在也没有组装😂好大一个箱子，性能外观什么的等用了之后再说。买回来到现在也没有组装😂好大一个箱子，性能外观什么的等用了之后再说。
2018-11-28 18:33:57,颜色分类:金色,外观非常好看，试用了一次，蒸汽开到最大量熨男士衬衫还行，唯一缺点容易留水渍（并没有喷头向下或平铺使用），再用用看吧。  对晟邦物流非常非常非常失望，货到了10多天就是不送货，打电话也不接，垃圾物流，希望商家再不要选择晟邦物流！！！
2018-11-01 12:16:45,颜色分类:金色,真的好用
2018-11-26 15:14:12,颜色分类:金色,还不错
2018-12-02 17:06:13,颜色分类:金色,很棒
2019-03-20 11:26:15,颜色分类:金色,一开始声音很大不出气还以为让我倒霉碰上问题了，原来是因为新机器第一次打开会这样，一分钟后就好了，挺好用，稳
2018-07-21 10:30:38,颜色分类:金色,一分价钱一分品质，毋庸置疑。不是三、五百的挂熨机可以相比的。但是新疆水质太硬等同矿泉水，我选择用纯净水。每个细节都体贴的考虑到，用看顺手顺心。特别是谁都不给新疆发货时，我却可以收到。所以有十星好评吗？
2018-05-28 13:29:05,颜色分类:金色,此用户没有填写评论!
2018-04-13 11:17:38,颜色分类:金色,安装很简单，可以五分钟内搞定。包装完好无损，快递非常准时送货，服务态度很好。以前用的各种挂烫都没有烫衣板，不换烫衬衫或者外套都没有支撑，让烫衣服要费劲许多，这款挂烫不但有烫衣板，烫衣板还有角度，这点太人性化了，看小红书里推荐的挂烫不少，这款也有被推，在淘宝评论里也做了下功课，果断买下，相信它的实用程度对得起价格。烫衣板够长，我个子178，烫衣服最怕弯腰，一个腰酸，一个也增加腰的压力，长期以往会对做家务有更深的阴影?这款挂烫目测不需要弯腰就可以烫好衣服，是高个子福音哦～ 机子用后会再来写用后感的。
2018-09-16 20:14:27,颜色分类:金色,好用
2018-11-16 16:36:33,颜色分类:金色,双十一后的第三天收到的，好大一箱货，还没用，期待效果
2018-12-15 19:52:51,颜色分类:金色,好
2018-06-09 11:25:12,颜色分类:金色,这件产品买的实在窝心。我是冲着品牌来的，但这个旗舰店的售后服务非常让人失望。收到货品当天就试用，发现指示灯显示正常工作，但烫头一直不能出蒸汽，一拿起烫头就有很响的哒哒声，好象管道堵塞，家人怀疑是空烧，因为水箱后方和水箱壁四周温度不正常，烫得吓人，之后旺旺联系商家，不是一直没有回音，就是好不容易有回复了却只有一句话，说咨询人多让人一直耐心排队等待，电话也从来没有人接听，让我都怀疑是假冒的旗舰店了。收货三天没有正常服务，无奈上网查到飞利浦官方一个联系网页，说让送当地检测点检测才知道是什么状况。我再次旺旺联系商家要求退货，却再也没有回复。无奈送检，拖着新买的机器来回奔波千里，看到全新的产品被开膛破肚，心力交瘁。然后被告之一定要出发票才能维修，所以才点了收货付了款。敬告所有在此店购买的顾客，在所谓的旗舰店购买，务必慎之又慎!售后服务是零!是零!是零!
2018-04-14 16:05:17,颜色分类:金色,很好很满意，相信大牌的品质，对比了多家最终选很好，效率很高！
2018-11-23 20:53:44,颜色分类:金色,真是无耻的客服，看点了确认收货就不发货了，一直没有信息查几天查不到，难道就确认收货你就不发货了，不是说不影响吗，再不见人也不见货，起码的信用都没有，会不会说系统问题，点了确认收货就是我的错，太差，客服别打电话，还是去实体店吧，真的价格一样的，这里便宜店里也一样，不要再上当，型号记好去店里看一样的价格
2018-06-25 21:20:22,颜色分类:金色,还没用，应该不错，以后追评
2018-08-14 17:34:29,颜色分类:金色,还没用
2018-12-14 16:13:58,颜色分类:金色,包装严实，出气大，用着方便。
2019-01-10 20:37:37,颜色分类:金色,包装结实，噪音小，方便好用，操作简单，效果好
2018-09-14 11:52:45,颜色分类:金色,使用不错，方便，造型喜欢，cs30棒棒哒，客服态度很好，耐心解答问题。
2018-12-17 14:50:52,颜色分类:金色,一分钱一分货，质量很好，外观也漂亮，和我家衣帽间色调很搭
2018-06-06 21:51:34,颜色分类:金色,以前我买过一个这牌子的，这次女儿买的，但还没用了，希望很好，大牌子吗
2018-12-23 10:07:12,颜色分类:金色,目前还不错
2019-03-11 14:35:08,颜色分类:金色,货品收到，不知质量怎样？用了再来评价。物流服务一流。
2018-09-20 23:31:52,颜色分类:金色,很好用，喜欢
2018-08-20 15:21:48,颜色分类:金色,此用户没有填写评论!
2018-07-14 18:13:25,颜色分类:金色,宝贝运来时箱子挺大的，安装简单，按照图片即可，颜色相符很干净的感觉，不错！等用后再来后续评价
2018-08-28 10:33:58,颜色分类:金色,冲着功率大，出气猛并且做活动买的，定的闹钟准点下单说送赠品，客服cs25和售后cs10有问必答，很是详细，感谢。
2018-06-20 11:24:23,颜色分类:金色,挂烫机蒸汽很大，设计也很人性化，客服cs21非常好，很有耐心。
2019-03-24 13:38:06,颜色分类:金色,挂烫机非常给力，蒸汽很大，加热很快，非常省事，一次可以烫好多衣服，方便快捷，飞利浦的家电还是很不错的，好评👌👌👌
2018-06-21 12:53:41,颜色分类:金色,真的特别高大上，也十分好用，和几百块的明显不是一个档次的
2018-02-26 12:22:11,颜色分类:金色,不错?
2018-09-11 18:53:28,颜色分类:金色,很好用，蒸汽很足一熨就好了。
2019-04-01 11:25:46,颜色分类:金色,第二次购买了，之前双十一给爸妈买了一个，用了一年多质量不错，现在自己组建了小家庭，又买了一个同款，虽然优惠没有双十一力度大但是急用也不差钱。发货很快老公很快组装完了，用起来很方便。客服CS26回复及时，有什么问题都耐心解答，服务很好。只是赠品的吐司机是后期发货，可能要等一个月，好在飞利浦是大品牌，相信没问题。推荐购买。
2018-06-20 21:33:49,颜色分类:金色,一直盯着飞利浦的挂烫机看了好久，在各个型号间比较权衡，直到看到了这款新产品，就无法拒绝了。首先从外观上，不得不说飞利浦的外观设计高贵典雅，让人看了有种赏心悦目的感觉，非常漂亮非常有质感；然后在产品功能设计上又匠心独运，结合人体工程学增加了可以调角度的烫板，真得实用又方便，最让我满意的设计是在喷头处的调节开关，充分考虑到了用户实际使用过程中的场景，有了这个在熨衣服时再也不用弯腰了；与其他产品比较，这款储水量大，蒸汽量大，调节档位高。最后加水通电用了一下，熨烫省时省力，不错的购物体验，试熨烫了几件衣服，不错！比家里旧的挂烫机要好得多！总之很喜欢！
2018-11-19 00:37:52,颜色分类:金色,质感非常好，安装很方便，挂烫效果很好，设计很人性化，使用很方便，服务非常好！飞利浦确实值得信赖！
2018-06-13 09:07:53,颜色分类:金色,好，但价格太贵
2018-07-26 11:52:20,颜色分类:金色,挺好用的 可以选择的功能很实用 包装也很仔细 五星好评
2018-06-21 09:28:34,颜色分类:金色,不错，操作起来方便，老式的熨烫机操作起来不太方便，还经常会烫坏衣服，这款挂烫机蒸汽很足，不易烫坏衣服，还很轻便，美中不足的是放衣服的挂板体积有些小，熨衣服时需要时不时调整衣服位置
2018-10-25 19:47:09,颜色分类:金色,此用户没有填写评论!
2018-06-29 12:37:10,颜色分类:金色,6月18日活动买的挂烫机，飞利浦品牌的家电就是好，值得信赖，家里有一台电熨斗，也是飞利浦的，很好用，有了挂烫机就更方便了，而且来的时候包装很结实，里里外外三层，很安全，值得推荐，很好。👍
2018-06-20 14:48:36,颜色分类:金色,看着很高大上的，看顾客好评如潮，618也入手一台，包装到位三层纸箱包装，拆了好久，打开安装简便，马上装水试了下，可直接接自来水，操作简单两键搞定，一个开关，一个气量调节，烫板可调节角度使用方使，不多说了，直接上图。
2018-10-01 17:09:35,颜色分类:金色,一般吧，还是有点失望的，效果很一般，烫起来很累，那块板很鸡肋感觉，我都拿下来烫的
2018-11-19 07:12:08,颜色分类:金色,安装比较容易，注意方向就行。颜色大气，有档次。加热时间稍长(初次用，一直不出蒸汽，以为坏了呢)，最方便的是手柄可以调蒸汽大小，挂上可暂停蒸汽，同时，有挂板做支撑烫衣服比较平整。喜欢。
2018-10-27 09:32:58,颜色分类:金色,设计不错，用起来很顺手，人性化，好用！
2018-11-25 21:52:50,颜色分类:金色,产品很好用，刚到就使用了，很方便，正品。
2019-02-28 11:38:39,颜色分类:金色,货回来了，买上安装，好用，刚开始不会用，开啦电源好久不出气，原来是拿起来才出气，费了好长时间搞明白了
2019-02-14 11:50:39,颜色分类:金色,此用户没有填写评论!
2019-02-26 16:34:34,颜色分类:金色,挺好用哒
2018-11-14 22:51:30,颜色分类:金色,朋友先拿去了，我的明天才到。先好评
2018-10-07 09:48:37,颜色分类:金色,宝贝收到了，包装太给力了，包了三层盒子，一点都没有损坏。烫衣板安装很方便，不过还没有使用，信赖飞利浦这个品牌，相信会不错的。
2018-06-29 16:49:06,颜色分类:金色,看起来不错！使用后追评！
2018-11-16 17:11:15,颜色分类:金色,试用了一下。感觉不错。
2018-06-06 08:38:46,颜色分类:金色,挺满意喜欢的，一分价钱一分货吧，一百多的手持式和三百多的单管都退休了，以后还是一步到位的买，不然更浪费～比以前的好用太多，没弄过瘾就熨烫好好几件衣服～棒棒哒～不过体积比预想的大一些～
2018-11-21 21:52:35,颜色分类:金色,才收到，开始用，感觉还不错哦
2019-04-03 10:56:08,颜色分类:金色,挂烫机总体说来不错，大的褶皱很容易就烫平了，但是小的褶皱烫不平，真的只能用熨斗。托板确实比较方便，但是顶部略高，底部又太短，而且窄了一些，导致上面有很大的空余，但两侧和下面又不够尺寸，熨男式衬衣不够顺手。蒸汽可以通过手柄控制，相当人性化，蒸汽够大，但是有时还是会有水珠喷在衣服上，客服cs6也很热情
2018-12-15 21:37:01,颜色分类:金色,收到就第一时间装起来，试用了一下，非常棒的挂烫机
2018-11-17 21:38:25,颜色分类:金色,不错
2018-06-24 14:23:02,颜色分类:金色,出门在外刚回来就装上了，挂烫机蛮好的，安装很简单，水槽很大一次应该可以烫好多件衣服了，接水也很方便档位也方便简单，送的防&apos;烫手套也实用。
2018-11-17 12:47:51,颜色分类:金色,下午收到，晚上就用上了，安装方便，蒸汽量大，外观设计非常漂亮。赞👍
2018-10-03 20:37:26,颜色分类:金色,新房子用的，使用之后再来好评
2018-11-22 15:22:35,颜色分类:金色,一般
2018-12-21 14:22:43,颜色分类:金色,安装方便，满意
2018-07-11 13:39:09,颜色分类:金色,此用户没有填写评论!
2018-08-29 16:34:46,颜色分类:金色,一分价钱一分货，这款真的好！
2018-12-10 12:01:20,颜色分类:金色,h h
2018-11-13 15:22:30,颜色分类:金色,双十一物美价廉，到货速度很快，挂烫机质量很好，总体很满意
2018-10-06 21:46:00,颜色分类:金色,收到线就是断的，联系客服，客服根本不搭理&hellip; 这服务态度也是醉了
2018-11-26 11:33:06,颜色分类:金色,这是一个好评模板，因为本仙女很懒，不想每个产品都写好评，所以特地模仿好友写下这个模板，但是这个产品无论是质量还是外形都是本仙女喜欢的类型，如果不喜欢，仙女收到东西会很生气，然后这个模板就会成为仙女喋喋不休的休书，自然不可能撒下这个好评，给各位淘友一个参考，本产品还是极好的，&mdash;&mdash;来自一位慵懒的只爱购物不爱写评语却想换积分的仙女！ 好吧，说真的，很好，喜欢。
2019-01-25 05:36:44,颜色分类:金色,质量很好推荐
2018-12-12 15:56:26,颜色分类:金色,此用户没有填写评论!
2018-11-13 18:58:27,颜色分类:金色,蛮好的！刚刚熨了一大堆衣服，感觉还是没有普通熨板方便，可能还没习惯！包装箱超大😂😂😂
2018-10-30 21:04:54,颜色分类:金色,非常满意，特别高端大气上档次做工精细，包装严实，没有破损也很精致漂亮，用分呗分期付款方式购买的 已经用过一段时间了，还是大品牌，值得信赖，已经推荐给朋友了，不管什么衣服都可以熨的非常不错。就是想买一款这样的商品。心满意足。还有赠品加湿器没有收到呢，希望早一天收到啊！商家这次优惠力度比较大，谢谢了！客服态度非常好，耐心解答，发货速度快。祝店家生意兴隆，财源广进。
2018-06-23 14:22:33,颜色分类:金色,活动价格入的 很划算
2018-11-13 16:41:22,颜色分类:金色,挂烫机是不错的，妹妹先买的，用过之后就长草了，功率大，熨烫衣服很快，包装严实，足足用了三层纸箱
2018-10-01 20:22:08,颜色分类:金色,应该不错
2018-11-23 12:05:35,颜色分类:金色,还没有使用，不过宝贝包装很好，很大气。
